address,name,online_order,book_table,rate,votes,location,rest_type,cuisines,cost,reviews_list,type
"276, Ground Floor, 100 Feet Outer Ring Road, Banashankari 3rd Stage, Banashankari, Bangalore",Petoo,False,False,3.7,21,Banashankari,Quick Bites,North Indian,450.0,"[('Rated 2.0', 'RATED\n  This is a neatly made little place with entertaining wall posts that promise to deliver some good food. Well, I was grossly mistaken. All they sell are some oddly named dishes that can hurt your taste buds and tummy, really bad!\n\nThis place runs on their masaledaar chole. The bright red colored dish is certainly an eyesore, plus can leave you sick with acidity!\n\nOverall, definitely not a place worth visiting again. A total disappointment, both on the money part and satisfaction part  :(')]",Delivery
"1514, 4th Cross, 7th Main, RPC layout, 2nd Stage, Vijay Nagar, Bangalore",Shree Cool Point,True,False,4.1,28,Vijay Nagar,Quick Bites,"Fast Food, Street Food, Beverages",150.0,"[('Rated 5.0', 'RATED\n  Who would say no to such healthy and tasty breakfast delivered to Ur home?\nHad ordered:\nMusk melon juice\nCarrot juice\nMushroom sandwich.\nSandwich was the show stealer. Perfectly spiced and grilled with generous amount of mushroom. I completely loved it and will order again soon?'), ('Rated 4.0', 'RATED\n  Dish 1: corn sandwich\nTaste : 4 / 5\nDish 2 : masala puri\nTaste : 4.5 / 5\nPlace : shree cool point ( vijaynagar)\nAmbience : No idea\nService : No idea since it was home delivery\nValue for money : 4 / 5\n\nFirstly corn sandwich was filled with corn, cheese n green chutney and perfectly toasted but it was little on the spicier side.. I am not really a big fan of masala puri.. But this was really yumm but felt quantity was less... Home delivery was quick and i also feel the prices wer affordable and totally worth the money...')]",Delivery
"808/6-1, 24th A Cross, K.R Road, 2nd Stage, Banashankari, Bangalore",Corner House Ice Cream,False,False,4.3,345,Banashankari,Dessert Parlor,"Ice Cream, Desserts",400.0,"[('Rated 3.0', ""RATED\n  Always a fan of corner house. Hadn't been to one in the longest time. Probably that is why it all felt different. It was all melty even before we started eating. It just did not feel like the classic corner house this time. Will definitely visit again though.""), ('Rated 5.0', ""RATED\n  As always, corner house is known for its same taste and quality throughout Bangalore! This outlet didn't disappoint as well. Dbc and Hcf are the best here and love the chocolate sauce here!""), ('Rated 4.0', 'RATED\n  Corner house is a best place for ice cream and DBC is the beat here, price is little expensive but the quantity and the quality is excellent'), ('Rated 4.0', 'RATED\n  One of my favourite place and DBC i love the most !! Must try . Place is quite good n itÃ\x83Â\x83Ã\x82Â\x82Ã\x83Â\x82Ã\x82Â\x92s quite pocket friendly too for the quantity they give !! Must visit !! Thumbs up'), ('Rated 5.0', 'RATED\n  I definitely prefer this place anytime and anywhere. Known for its taste And varieties of ice cream this is my #1 choice to hangout. Death by chocolate is a must have at this place and chocolate mousse with cream and ice cream is one of my favourites. The place might be quite small and crowded post evening but the service is accurate. They are hygienic and a pretty decent ambience for sure.'), ('Rated 5.0', 'RATED\n  All though there are many ice cream parlours in Bangalore! This is my favourite in the list ? I have been here many times, I have never returned back disappointed ? Yes literally love all flavours here, DBC again tops the list?? One should definitely have DBC here! More then everything the quantity is good and so as the price ??I can say itÃ\x83Â\x83Ã\x82Â\x82Ã\x83Â\x82Ã\x82Â\x92s the best in city with more 16+ outlets all over Bangalore\nToday we tired choco nutty and choco almond sundae with DBC?'), ('Rated 5.0', ""RATED\n  This is definitely my happy place because it makes my soul dance! Being one of the well known dessert places corn house is favorite for each and every dessert lover! How can someone not have death by chocolate from corner House? It's one of the most satisfying things ever!\nStarting from DBC,Cake fudge, cashew fudge to caramel to fruit salad with ice cream, corner House have it all!\nThe more I eat,the more I crave for it !!""), ('Rated 3.0', 'RATED\n  Food - 9/10\nService - 8/10\nAmbience - 8/10\n\nVery good place to have some delicious icecreames, milkshakes and pastries.\nStar dishes like DBC & Lychee with icecream are must try ones.\nStaff is very friendly. Ambience is well lit and easy to access it.')]",Delivery
"10, Stavyah Arcade, 3rd Floor 9th Main, Yarab Nagar Main Road, Banashankari, Bangalore",Freshmenu,True,False,3.9,627,Banashankari,Delivery,"Healthy Food, Chinese, Biryani, North Indian, Continental, Salad, American, Burger",450.0,"[('Rated 5.0', 'RATED\n  What: continental food\n\nOnline delivery food chain.\n\nLast time when the food was delivered in a bad condition, had second thoughts for ordering again from this place. Being skeptical ordered chicken noodles but to my surprise the food was yummy. This time they delivered Wat was ordered.\n\nThanks for the prompt delivery and did really enjoyed the food.'), ('Rated 3.0', 'RATED\n  Long pending review... I have been wanting to review but some how got postponed. I had ordered food few weeks back as I was alone. I ordered spinach potpie and lucknowie panner biryani\nI liked the potpie, but biryani taste was average. May be I should few more of their items.'), ('Rated 3.0', 'RATED\n  2 star is the rating for the quantity of food. I would give a 4 star rating for quality. Averaging is the final score.\n\nI was severely disappointed at the quantity of Ceaser salad. Brands like eat-fit would give double the quantity for the same price. I mean come on, atlest a decent amount of lettuce so that you fill your hunger. I ordered the pot pie in a seperate order after the salad just cause the salad was not enough. The cheese potpie was lacking salt and taste. I get that this is healthy food but doesnt mean we need to skip on basic condiments.\n\nNot very keen on ordering again from fresh menu unless there is no other option.'), ('Rated 5.0', ""RATED\n  Down right the best comfort food of all times. The menu consists of such light and soothing food that doesn't make you feel stubby. Also this gulab jamum mango jar is to die for""), ('Rated 3.0', 'RATED\n  Ordered a southwestern fried chicken, creamy pepper fusilli and cookie dough cake. Fried chicken didnÃ\x83Â\x83Ã\x82Â\x82Ã\x83Â\x82Ã\x82Â\x92t seem like the one on the picture. The chicken was cooked well but flavour was lacking. Fusilli pasta as well lacked the herbs. Cookie dough cake was yummy though.'), ('Rated 4.0', 'RATED\n  Time for healthy and yummy food,get it ordered from your nearest freshmenu outlet.Now I forgot the names of the dish but as you see one of them is Arabian pasta which was cold by the time it got delivered yet tasty and the best thing was this paneer salad filled with loads of veggies definitely filled me over, but main courses are still the best if you ask me')]",Delivery
"218/1,11th Main, 50 Feet Road, Hanumanthnagar, Banashankari, Bangalore",Banashankari Donne Biriyani,True,False,3.8,104,Banashankari,Quick Bites,"Biryani, Fast Food",300.0,"[('Rated 3.0', 'RATED\n  Pretty much hyped place u can say... taste and quality as usual like other donne biryani... nothing so unique or usp as such.... kabab was very bad and so were the mutton items... couldve been faaaar better...')]",Delivery
"808/6-1, 24th A Cross, K.R Road, 2nd Stage, Banashankari, Bangalore",Corner House Ice Cream,False,False,4.3,345,Banashankari,Dessert Parlor,"Ice Cream, Desserts",400.0,"[('Rated 3.0', ""RATED\n  Always a fan of corner house. Hadn't been to one in the longest time. Probably that is why it all felt different. It was all melty even before we started eating. It just did not feel like the classic corner house this time. Will definitely visit again though.""), ('Rated 5.0', ""RATED\n  As always, corner house is known for its same taste and quality throughout Bangalore! This outlet didn't disappoint as well. Dbc and Hcf are the best here and love the chocolate sauce here!""), ('Rated 4.0', 'RATED\n  Corner house is a best place for ice cream and DBC is the beat here, price is little expensive but the quantity and the quality is excellent'), ('Rated 4.0', 'RATED\n  One of my favourite place and DBC i love the most !! Must try . Place is quite good n itÃ\x83Â\x83Ã\x82Â\x82Ã\x83Â\x82Ã\x82Â\x92s quite pocket friendly too for the quantity they give !! Must visit !! Thumbs up'), ('Rated 5.0', 'RATED\n  I definitely prefer this place anytime and anywhere. Known for its taste And varieties of ice cream this is my #1 choice to hangout. Death by chocolate is a must have at this place and chocolate mousse with cream and ice cream is one of my favourites. The place might be quite small and crowded post evening but the service is accurate. They are hygienic and a pretty decent ambience for sure.'), ('Rated 5.0', 'RATED\n  All though there are many ice cream parlours in Bangalore! This is my favourite in the list ? I have been here many times, I have never returned back disappointed ? Yes literally love all flavours here, DBC again tops the list?? One should definitely have DBC here! More then everything the quantity is good and so as the price ??I can say itÃ\x83Â\x83Ã\x82Â\x82Ã\x83Â\x82Ã\x82Â\x92s the best in city with more 16+ outlets all over Bangalore\nToday we tired choco nutty and choco almond sundae with DBC?'), ('Rated 5.0', ""RATED\n  This is definitely my happy place because it makes my soul dance! Being one of the well known dessert places corn house is favorite for each and every dessert lover! How can someone not have death by chocolate from corner House? It's one of the most satisfying things ever!\nStarting from DBC,Cake fudge, cashew fudge to caramel to fruit salad with ice cream, corner House have it all!\nThe more I eat,the more I crave for it !!""), ('Rated 3.0', 'RATED\n  Food - 9/10\nService - 8/10\nAmbience - 8/10\n\nVery good place to have some delicious icecreames, milkshakes and pastries.\nStar dishes like DBC & Lychee with icecream are must try ones.\nStaff is very friendly. Ambience is well lit and easy to access it.')]",Desserts
"276, Ground Floor, 100 Feet Outer Ring Road, Banashankari 3rd Stage, Banashankari, Bangalore",Petoo,False,False,3.7,21,Banashankari,Quick Bites,North Indian,450.0,"[('Rated 2.0', 'RATED\n  This is a neatly made little place with entertaining wall posts that promise to deliver some good food. Well, I was grossly mistaken. All they sell are some oddly named dishes that can hurt your taste buds and tummy, really bad!\n\nThis place runs on their masaledaar chole. The bright red colored dish is certainly an eyesore, plus can leave you sick with acidity!\n\nOverall, definitely not a place worth visiting again. A total disappointment, both on the money part and satisfaction part  :(')]",Dine-out
"218/1,11th Main, 50 Feet Road, Hanumanthnagar, Banashankari, Bangalore",Banashankari Donne Biriyani,True,False,3.8,104,Banashankari,Quick Bites,"Biryani, Fast Food",300.0,"[('Rated 3.0', 'RATED\n  Pretty much hyped place u can say... taste and quality as usual like other donne biryani... nothing so unique or usp as such.... kabab was very bad and so were the mutton items... couldve been faaaar better...')]",Dine-out
